{
  "kind": "evidence-artifact",
  "schemaVersion": "1.1.0",
  "id": "import-review-base",
  "version": "1.0.0",
  "origin": "synthetic",
  "file": {
    "path": "data/import-0.json",
    "sha256": "64cac491fd40d4c9ede000878e966032ef1a5ecfba9873173edbec82f2fc926b",
    "mediaType": "application/json"
  },
  "capturedAt": "2026-10-17T00:00:00Z",
  "product": null,
  "scope": [
    "import-line"
  ]
}
